{
  "schemaVersion": "agentplane.wallguard-collaboration-admission.v0.1",
  "recordType": "WallGuardCollaborationAdmissionReceipt",
  "receipt_id": "wallguard-collab-admission:same-wall-subagent-delegation-001",
  "collaboration_request_id": "collab-request:client-a-matter-x:subagent-001",
  "source_agent_wall_context_ref": "agent-wall-context://orchestrator-agent/client-a/matter-x",
  "target_agent_wall_context_ref": "agent-wall-context://subagent-b/client-a/matter-x",
  "source_wall_ref": "wall://client-a/matter-x",
  "target_wall_ref": "wall://client-a/matter-x",
  "collaboration_action": "subagent_delegation",
  "admitted": true,
  "admission_decision": "admit",
  "reason_code": "same_wall_allowed",
  "wall_decision_ref": "wallguard-decision://same-wall-delegation-allow-001",
  "wall_decision_outcome": "allow",
  "evidence_refs": [
    "evidence://agentplane/wallguard/same-wall-subagent-delegation-001"
  ],
  "receipt_hash": "sha256:bbbb2222bbbb2222bbbb2222bbbb2222bbbb2222bbbb2222bbbb2222bbbb2222",
  "issued_at": "2024-01-15T10:01:00Z"
}
