{
  "schemaVersion": "agentplane.wallguard-collaboration-admission.v0.1",
  "recordType": "WallGuardCollaborationAdmissionReceipt",
  "receipt_id": "wallguard-collab-admission:same-wall-001",
  "collaboration_request_id": "collab-request:client-a-matter-x:001",
  "source_agent_wall_context_ref": "agent-wall-context://agent-alpha/client-a/matter-x",
  "target_agent_wall_context_ref": "agent-wall-context://agent-beta/client-a/matter-x",
  "source_wall_ref": "wall://client-a/matter-x",
  "target_wall_ref": "wall://client-a/matter-x",
  "collaboration_action": "agent_message",
  "admitted": true,
  "admission_decision": "admit",
  "reason_code": "same_wall_allowed",
  "wall_decision_ref": "wallguard-decision://same-wall-allow-001",
  "wall_decision_outcome": "allow",
  "evidence_refs": [
    "SocioProphet/ProCybernetica#103",
    "SocioProphet/agent-registry#45"
  ],
  "receipt_hash": "sha256:aaaaaaaaaaaaaaaaaaaaaaaaaaaaaaaaaaaaaaaaaaaaaaaaaaaaaaaaaaaaaaaa",
  "issued_at": "2026-05-29T00:00:00Z"
}
